{
  "generated_at": "2026-07-21T18:25:15",
  "count": 13,
  "field_count": 10,
  "value_count": 134,
  "summary": {
    "configured_values": 33,
    "fields": 10,
    "high": 5,
    "medium": 109,
    "merge_candidate": 100,
    "none": 20,
    "split_candidate": 5,
    "stable": 20,
    "unused_config": 9
  },
  "fields": [
    {
      "field": "domains",
      "label": "结构域",
      "english": "Domain",
      "query_key": "domain",
      "is_list": true,
      "configured_count": 2,
      "used_count": 2,
      "unused_count": 0,
      "singleton_count": 1,
      "overloaded_count": 1,
      "max_value": "LLM Systems",
      "max_count": 10,
      "max_share": 0.7692,
      "effective_count": 1.36,
      "balance_score": 17,
      "href": "library.html"
    },
    {
      "field": "tracks",
      "label": "方向",
      "english": "Track",
      "query_key": "track",
      "is_list": true,
      "configured_count": 5,
      "used_count": 5,
      "unused_count": 0,
      "singleton_count": 2,
      "overloaded_count": 1,
      "max_value": "Inference Acceleration",
      "max_count": 8,
      "max_share": 0.6154,
      "effective_count": 3.67,
      "balance_score": 31,
      "href": "library.html"
    },
    {
      "field": "problems",
      "label": "问题",
      "english": "Problem",
      "query_key": "problem",
      "is_list": true,
      "configured_count": 11,
      "used_count": 11,
      "unused_count": 0,
      "singleton_count": 10,
      "overloaded_count": 0,
      "max_value": "Lossless Speculative Decoding",
      "max_count": 3,
      "max_share": 0.2308,
      "effective_count": 10.09,
      "balance_score": 42,
      "href": "library.html"
    },
    {
      "field": "topics",
      "label": "主题",
      "english": "Topic",
      "query_key": "topic",
      "is_list": true,
      "configured_count": 35,
      "used_count": 35,
      "unused_count": 0,
      "singleton_count": 28,
      "overloaded_count": 1,
      "max_value": "Speculative Decoding",
      "max_count": 8,
      "max_share": 0.6154,
      "effective_count": 26.49,
      "balance_score": 23,
      "href": "library.html"
    },
    {
      "field": "methods",
      "label": "方法",
      "english": "Method",
      "query_key": "method",
      "is_list": true,
      "configured_count": 58,
      "used_count": 58,
      "unused_count": 0,
      "singleton_count": 55,
      "overloaded_count": 0,
      "max_value": "Speculative Decoding",
      "max_count": 3,
      "max_share": 0.2308,
      "effective_count": 56.22,
      "balance_score": 40,
      "href": "library.html"
    },
    {
      "field": "research_line",
      "label": "研究线",
      "english": "Research line",
      "query_key": "line",
      "is_list": false,
      "configured_count": 5,
      "used_count": 5,
      "unused_count": 0,
      "singleton_count": 2,
      "overloaded_count": 0,
      "max_value": "Parallel Decoding with Diffusion Models",
      "max_count": 4,
      "max_share": 0.3077,
      "effective_count": 4.34,
      "balance_score": 55,
      "href": "library.html"
    },
    {
      "field": "line_role",
      "label": "研究线角色",
      "english": "Line role",
      "query_key": "role",
      "is_list": false,
      "configured_count": 6,
      "used_count": 6,
      "unused_count": 0,
      "singleton_count": 2,
      "overloaded_count": 0,
      "max_value": "main",
      "max_count": 3,
      "max_share": 0.2308,
      "effective_count": 5.59,
      "balance_score": 64,
      "href": "library.html"
    },
    {
      "field": "status",
      "label": "阅读状态",
      "english": "Status",
      "query_key": "status",
      "is_list": false,
      "configured_count": 5,
      "used_count": 1,
      "unused_count": 4,
      "singleton_count": 0,
      "overloaded_count": 1,
      "max_value": "read",
      "max_count": 13,
      "max_share": 1.0,
      "effective_count": 1.0,
      "balance_score": 0,
      "href": "library.html"
    },
    {
      "field": "reading_stage",
      "label": "阅读阶段",
      "english": "Reading stage",
      "query_key": "stage",
      "is_list": false,
      "configured_count": 4,
      "used_count": 2,
      "unused_count": 2,
      "singleton_count": 0,
      "overloaded_count": 1,
      "max_value": "deep_read",
      "max_count": 8,
      "max_share": 0.6154,
      "effective_count": 1.65,
      "balance_score": 38,
      "href": "library.html"
    },
    {
      "field": "review_stage",
      "label": "复习阶段",
      "english": "Review stage",
      "query_key": "reviewStage",
      "is_list": false,
      "configured_count": 3,
      "used_count": 0,
      "unused_count": 3,
      "singleton_count": 0,
      "overloaded_count": 0,
      "max_value": "",
      "max_count": 0,
      "max_share": 0.0,
      "effective_count": 0.0,
      "balance_score": 0,
      "href": "library.html"
    }
  ],
  "values": [
    {
      "field": "domains",
      "field_label": "结构域",
      "english": "Domain",
      "query_key": "domain",
      "value": "LLM Systems",
      "count": 10,
      "share": 0.7692,
      "configured": true,
      "definition_status": "active",
      "owner_name": "systems",
      "action": "split_candidate",
      "severity": "high",
      "href": "library.html?domain=LLM+Systems",
      "sample_slugs": [
        "2607.00466-eldr",
        "2503.14075-twigvlm-plus-plus",
        "noarxiv-2026-dspark",
        "2602.06036-dflash",
        "2604.11035-introspective-dlm"
      ],
      "recommendation": "结构域 过大，考虑拆成更细子类。"
    },
    {
      "field": "domains",
      "field_label": "结构域",
      "english": "Domain",
      "query_key": "domain",
      "value": "Multimodal Systems",
      "count": 1,
      "share": 0.0769,
      "configured": false,
      "definition_status": "",
      "owner_name": "",
      "action": "merge_candidate",
      "severity": "medium",
      "href": "library.html?domain=Multimodal+Systems",
      "sample_slugs": [
        "2503.14075-twigvlm-plus-plus"
      ],
      "recommendation": "检查是否应合并为更通用标签。"
    },
    {
      "field": "tracks",
      "field_label": "方向",
      "english": "Track",
      "query_key": "track",
      "value": "Inference Acceleration",
      "count": 8,
      "share": 0.6154,
      "configured": false,
      "definition_status": "",
      "owner_name": "",
      "action": "split_candidate",
      "severity": "high",
      "href": "library.html?track=Inference+Acceleration",
      "sample_slugs": [
        "2607.00466-eldr",
        "2503.14075-twigvlm-plus-plus",
        "noarxiv-2026-dspark",
        "2602.06036-dflash",
        "2604.11035-introspective-dlm"
      ],
      "recommendation": "方向 过大，考虑拆成更细子类。"
    },
    {
      "field": "tracks",
      "field_label": "方向",
      "english": "Track",
      "query_key": "track",
      "value": "Parallel Decoding",
      "count": 5,
      "share": 0.3846,
      "configured": false,
      "definition_status": "",
      "owner_name": "",
      "action": "stable",
      "severity": "none",
      "href": "library.html?track=Parallel+Decoding",
      "sample_slugs": [
        "noarxiv-2026-dspark",
        "2602.06036-dflash",
        "2604.11035-introspective-dlm",
        "2605.12825-orthrus",
        "2507.11851-llm-future-mtp"
      ],
      "recommendation": "结构稳定，继续积累样本。"
    },
    {
      "field": "tracks",
      "field_label": "方向",
      "english": "Track",
      "query_key": "track",
      "value": "Attention Kernels",
      "count": 2,
      "share": 0.1538,
      "configured": false,
      "definition_status": "",
      "owner_name": "",
      "action": "stable",
      "severity": "none",
      "href": "library.html?track=Attention+Kernels",
      "sample_slugs": [
        "2501.01005-flashinfer",
        "2307.08691-flashattention-2"
      ],
      "recommendation": "结构稳定，继续积累样本。"
    },
    {
      "field": "tracks",
      "field_label": "方向",
      "english": "Track",
      "query_key": "track",
      "value": "Inference Serving Systems",
      "count": 1,
      "share": 0.0769,
      "configured": false,
      "definition_status": "",
      "owner_name": "",
      "action": "merge_candidate",
      "severity": "medium",
      "href": "library.html?track=Inference+Serving+Systems",
      "sample_slugs": [
        "2501.01005-flashinfer"
      ],
      "recommendation": "检查是否应合并为更通用标签。"
    },
    {
      "field": "tracks",
      "field_label": "方向",
      "english": "Track",
      "query_key": "track",
      "value": "VLM Acceleration",
      "count": 1,
      "share": 0.0769,
      "configured": false,
      "definition_status": "",
      "owner_name": "",
      "action": "merge_candidate",
      "severity": "medium",
      "href": "library.html?track=VLM+Acceleration",
      "sample_slugs": [
        "2503.14075-twigvlm-plus-plus"
      ],
      "recommendation": "检查是否应合并为更通用标签。"
    },
    {
      "field": "problems",
      "field_label": "问题",
      "english": "Problem",
      "query_key": "problem",
      "value": "Lossless Speculative Decoding",
      "count": 3,
      "share": 0.2308,
      "configured": false,
      "definition_status": "",
      "owner_name": "",
      "action": "stable",
      "severity": "none",
      "href": "library.html?problem=Lossless+Speculative+Decoding",
      "sample_slugs": [
        "noarxiv-2026-dspark",
        "2602.06036-dflash",
        "2507.11851-llm-future-mtp"
      ],
      "recommendation": "结构稳定，继续积累样本。"
    },
    {
      "field": "problems",
      "field_label": "问题",
      "english": "Problem",
      "query_key": "problem",
      "value": "Customizable Attention Serving",
      "count": 1,
      "share": 0.0769,
      "configured": false,
      "definition_status": "",
      "owner_name": "",
      "action": "merge_candidate",
      "severity": "medium",
      "href": "library.html?problem=Customizable+Attention+Serving",
      "sample_slugs": [
        "2501.01005-flashinfer"
      ],
      "recommendation": "检查是否应合并为更通用标签。"
    },
    {